date,title,url,summary
"Wed, 21 Jan 2026 08:00:00 GMT",С сегодняшнего дня: Сбербанк ввел изменения для всех пользователей «Сбербанк Онлайн» - ProGorodNN,https://progorodnn.ru/news/144537,"\n ""},""content_type"":""banner"",""overlay_start_after"":0,""overlay_close_after"":10000000,""action_button_title"":"""",""tracking_url"":{},""player_show_skip_button_seconds"":5,""player_show_title"":true,""click_event_view"":""whole"",""auto_play"":true,""logo_url"":null,""thumbnail"":"""",""tracking_js"":{""impression"":[""https://js.ad-score.com/score.min.js?pid=1000692#tid=web&l1=14819_direct&l2=593670_direct&l3=1299529_direct&l4=progorodnn.ru&l5=soloway-banner_833422&l6=13992036&ref=https%3A%2F%2Fprogorodnn.ru%2F&pub_domain=progorodnn.ru&utid=07b3d728-7a22-4ced-53d6-5c531360e7a4&uid=1dabd820-ccf2-473f-7c14-a0a6e5bff3d3&cb=439266655826000507&adid=07b3d728-7a22-4ced-53d6-5c531360e7a4&auto_refresh=0""]},""click_event_url"":"""",""skip_clickthru"":false,""landing_link_text"":"""",""landing_link_position"":""right"",""displayed_price"":"""",""js_wrapper_url"":"""",""event_url"":""https://exchange.buzzoola.com/event/8c29c6c0-45da-4ac1-7eb7-8091481c351b/07b3d728-7a22-4ced-53d6-5c531360e7a4/kbDH64c7yFYnf8H9GhemxpjwWpQsv1hOjpBxIXEvYcvuedPqexbazCOTMvAVP-6RRLuX7hNgoGnYg3nZgcSMzA/"",""resend_event_url"":""https://exchange.buzzoola.com/resend_event/8c29c6c0-45da-4ac1-7eb7-8091481c351b/07b3d728-7a22-4ced-53d6-5c531360e7a4/kbDH64c7yFYnf8H9GhemxpjwWpQsv1hOjpBxIXEvYcvuedPqexbazCOTMvAVP-6RRLuX7hNgoGnYg3nZgcSMzA/"",""creative_hash"":""kbDH64c7yFYnf8H9GhemxpjwWpQsv1hOjpBxIXEvYcvuedPqexbazCOTMvAVP-6RRLuX7hNgoGnYg3nZgcSMzA"",""custom_html"":"""",""custom_js"":"""",""campaign_id"":-1,""line_item_id"":-1,""creative_id"":-1,""extra"":{""imp_id"":""07b3d728-7a22-4ced-53d6-5c531360e7a4"",""rtime"":""2026-02-16 20:46:04""},""auction_settings"":null,""ad_format_type"":""banner"",""show_legal_info"":true,""ad_label_info"":{""ad_labels"":[[""Рекламодатель"",""https://alfaforex.ru""],[""ERID"",""2SDnjeg17jW""]],""seller_link"":""https://alfaforex.ru""},""verifiers_js"":{},""click_block_time"":0,""age_restriction"":"""",""measure_audibility"":false,""is_social_ad"":false}],""tracking_urls"":{},""tracking_js"":{},""placement"":{""placement_id"":1299529,""unit_type"":""inread"",""unit_settings"":{""align"":""center"",""autoplay_enable_sound"":false,""container_height"":""300"",""creative_display_duration"":10,""creatives_amount"":1,""header_selector"":"""",""sound_control"":""default"",""width"":""300""},""unit_settings_list"":[],""disallow_fpc"":false,""code_settings"":{},""env_type"":""web""},""uuid"":""1dabd820-ccf2-473f-7c14-a0a6e5bff3d3"",""auction_id"":""8c29c6c0-45da-4ac1-7eb7-8091481c351b"",""env"":""prod""}; var containerId = ""Caramel_2R5uXMUx9e""; var renderContainer; var nonce = """"; try { renderContainer = document.currentScript.parentNode; nonce = document.currentScript.nonce; } catch (e) {} if (!renderContainer) renderContainer = d.getElementById(containerId); var initTS = Date.now(); function loadScript(src, cb) { var s = d.createElement('script'); s.onload = function () { cb && cb() }; s.onerror = function () { cb && cb(true) }; s.src = src; s.async = true; s.nonce = nonce; d.body.appendChild(s); } function mergeTracking(obj) { var names = ['tracking_url', 'tracking_urls'], i, field, trackings, event, urls; for (i = 0; i < names.length; i++) { field = names[i]; if (obj[field] == null) { obj[field] = {}; } } trackings = obj.tracking_urls; for (event in obj.tracking_url) { if (!obj.tracking_url.hasOwnProperty(event)) continue; urls = obj.tracking_url[event]; trackings[event] = [].concat(trackings[event] || [], urls); } delete obj.tracking_url; return obj; } function createPlayer() { var p = d.createElement('div'), player; if (env) p.setAttribute('data-debug_env', env); if (renderContainer) { renderContainer.appendChild(p); mergeTracking(playerData); var b = w.Buzzoola, referrer = document.referrer, XHRHeaders = {}, data = mergeTracking(playerData.crs[0] || {}), ctorUrl = data.event_url + 'ctor', ctorParams = { site: encodeURIComponent(b.Utils.getTopWindowUrl()), version: (b.version || {}).timestamp, ms_since_init: Date.now() - initTS }, ctorQuery = [], auction = data.auctions_settings, requestDictionary = { external: 'extra_data', slugname: 'slugname', version: 'version' }, retries = 3, trackingTargets = [ { collection: playerData.tracking_urls || {}, type: 'url' }, { collection: data.tracking_urls || {}, type: 'url' }, { collection: playerData.tracking_js || {}, type: 'script' }, { collection: data.tracking_js || {}, type: 'script' } ], trackingHeaders = { 'Content-Type': 'application/x-www-form-urlencoded' }, trackingQuery = 'site=' + encodeURIComponent(w.Buzzoola.Utils.getTopWindowUrl()), prop; playerData.crs = [data]; if (referrer && referrer.length > 255) referrer = referrer.substring(0, 255); XHRHeaders['X-Alt-Referer'] = referrer; if (! !data.extra && b.Utils.isObject(data.extra)) { ctorParams = b.Utils.extend(ctorParams, data.extra); } if (! !auction && b.Utils.isObject(auction) && auction.event_name === 'ctor' && parseInt(auction.time_slice, 10) === 0) { ctorParams = b.Utils.extend(ctorParams, { cur: auction.currency, price: auction.price }); } for (prop in ctorParams) { ctorQuery.push((requestDictionary[prop] || prop) + '=' + ctorParams[prop]); } function sendCtorEvent() { w.Buzzoola.Utils.sendRequest(ctorUrl, 'POST', ctorQuery.join('&'), { withCredentials: true, timeout: 3000 }, XHRHeaders).then(function (result) { var xhr = result.xhr; if (200 > xhr.status || xhr.status > 400) { return Promise.reject(new Error('Bad request status')); } }).catch(function () { if (--retries > 0) { setTimeout(function () { sendCtorEvent(); }, 1000); } }) } function trackURL(url) { var eventUrl = url.replace(/\${RND}/g, Math.round(Math.random() * 1000000000)); if (/\.buzzoola\.com/g.test(w.Buzzoola.Utils.parseURLString(eventUrl).origin)) { w.Buzzoola.Utils.sendRequest(eventUrl, 'POST', trackingQuery, { withCredentials: true, timeout: 3000 }, trackingHeaders); } else { w.Buzzoola.Utils.fetchImage(eventUrl); } } function trackScript(url) { w.Buzzoola.Utils.loadScript(url); } function trackCtorEvent() { trackingTargets.forEach(function (target) { var collection = target.collection, trackerMethod = target.type === 'script' ? trackScript : trackURL; if (Array.isArray(collection.ctor)) collection.ctor.forEach(trackerMethod); }); } (function emitCtor() { sendCtorEvent(); trackCtorEvent(); })(); function strategyFactory(strategy) { function eventHandler(event) { var args = Array.prototype.slice.call(arguments); if (event === 'ctor') return false; return player.callStrategyByMaxWeight.apply(player, [strategy, 999000].concat(args)); } player.addStrategy(strategy, 999999, eventHandler); } player = new w.Buzzoola.Core(p, { adInitTS: initTS, adUrl: 'creative/json', data: playerData }); ['api:send_event', 'tracking_url:send'].forEach(strategyFactory); } } if (w.Buzzoola != null && w.Buzzoola.Buzzplayer != null) { createPlayer(); } else { loadScript('https://tube.buzzoola.com/new/build/buzzlibrary.js', function (err) { if (err) { } else { createPlayer(); } }); } })(window, document); Рекламодатель: https://alfaforex.ru"
"Thu, 22 Jan 2026 08:00:00 GMT",Волго-Вятский банк Сбербанка помог уберечь от мошенников 680 млн рублей - иа сусанин,https://susanin.news/russia/other/20260122-335522/,"В Нижегородской области от злоумышленников смогли уберечь 178 млн рублей, в Пермском крае — свыше 169 млн рублей, в Чувашской Республике — более 70 млн рублей. В Республике Марий Эл благодаря Сберу было сохранено 34 млн рублей, во Владимирской области — 32,5 млн рублей, в Республике Мордовия — 11,6 млн рублей. Сегодня наиболее распространены бытовые сценарии по темам ЖКХ: замена домофона, электрики, сантехники, а также используется тематика доставки по почте, через маркетплейсы и курьерами. Актуальной схемой мошенничества также остаётся получение доступа к аккаунту на «Госуслугах»."
"Thu, 22 Jan 2026 08:00:00 GMT","Доказать ничего не можем, но вы нам должны - Банки.ру",https://www.banki.ru/services/responses/bank/response/12871521/,"Никаких документальных подтверждений нет, но деньги требуют. И никакой истории что было до, и что стало после с 2014 по 2025. У них нет ответа почему банк не давал об этом никак знать и как человек может быть вообще не в курсе, что у него там задолженность висит столько лет. До декабря 2024 года все задолженности..."
"Tue, 20 Jan 2026 08:00:00 GMT","Чистая прибыль Сбербанка выросла на 8,4% и достигла 1,69 трлн рублей | IF | 20.01.2026 - InvestFuture",https://investfuture.ru/articles/chistaya-pribyl-sberbanka-vyrosla-na-8-4-i-dostigla-1-69-trln-rubley-1173431836,"Чистая прибыль Сбербанка по отечественным стандартам бухгалтерского учета за прошлый год увеличилась на 8,40%, достигнув 1,69 триллиона рублей, как сообщила финансовая организация. Чистые комиссионные доходы снизились на 2,60%, составив 726,80 миллиарда рублей, а в декабре снижение составило 2,40% год к году. Это обусловлено высокой базой прошлого года, связанной с единовременным признанием доходов по корпоративным клиентам и увеличением популярности программы ""Сберспасибо"". Число активных корпоративных клиентов составило 3,50 миллиона компаний, что на 6,20% больше с начала года"", - отметили также в банке."
"Tue, 20 Jan 2026 11:33:17 GMT",ВЗГЛЯД: Потенциал роста акций Сбербанка составляет около 38% на горизонте года - ПСБ - profinansy.ru,https://lenta.profinansy.ru/news/4934517,"Сбербанк в декабре 2025 года заработал 126 млрд руб. (+7,1% к декабрю 2024 года), а за весь 2025 год - 1,7 трлн руб. (+8,4% г/г), отмечает эксперт. - Рост процентного дохода составил 18% - несмотря на существенную долю активов с плавающими ставками, Сбербанк смог сохранить процентную маржу (NIM) на высоком уровне за счет более быстрого снижения ставок по привлекаемым пассивам"". Основным риском на текущий год, по мнению аналитика, остается рост резервирования в корпоративном сегменте, который, вероятно, будет компенсирован дальнейшим ростом процентных доходов (в условиях снижения ключевой ставки Сбер подтвердил эффективное управление процентной маржей). ""Ожидаем новых рекордов по прибыли Сбербанка в 2026 году до ~1,8 трлн руб. и подтверждаем оценку целевой цены обыкновенных акций на ближайшие 12 месяцев на уровне 420 руб. с потенциалом роста около 38%"", - делает вывод стратег ПСБ."
"Tue, 20 Jan 2026 08:00:00 GMT",Сбербанк приобрёл долю АФК «Система» в микроэлектронном холдинге «Элемент» | IF | 20.01.2026 - InvestFuture,https://investfuture.ru/articles/sberbank-priobryol-dolyu-afk-sistema-v-mikroelektronnom-kholdinge-element,"Стоимость доли оценивается примерно в 24 млрд рублей, а вся компания — более чем в 50 млрд рублей. Соглашение было закрыто перед Новым годом, однако остаются некоторые условия, которые должны быть выполнены до конца января. Все производственные активы «Элемента» перейдут под управление дочерней компании Сбербанка. «Элемент» был создан в 2019 году на базе активов АФК «Система» и «Ростеха» и является крупнейшим отечественным производителем микроэлектроники."
"Thu, 22 Jan 2026 08:00:00 GMT",Сбербанк планирует в 2026 году значимо увеличить прибыль - Русская служба The Moscow Times,https://ru.themoscowtimes.com/2026/01/22/sberbank-planiruet-v-2026-godu-znachimo-uvelichit-pribyl-a185131,"Не удается получить доступ к сайту Сайт ru.themoscowtimes.com неожиданно разорвал соединение. - Проверьте настройки прокси-сервера и брандмауэра. - Выполните диагностику сети в Windows ERR_CONNECTION_CLOSED Проверьте подключение к интернету. Проверьте соединение кабелей, перезагрузите маршрутизаторы, модемы и другие сетевые устройства."
"Thu, 22 Jan 2026 08:00:00 GMT","""Сбер"" остается одной из лучших бумаг на рынке - Финам.Ру",https://www.finam.ru/publications/item/sber-ostaetsya-odnoy-iz-luchshikh-bumag-na-rynke-20260122-1045/,"Но! В основной массе это те, кому прикрыли (или не открыли) кредитные линии в банках. Второй фактор - это налог на прибыль, выросший с 20% до 25% с 25 года. «Сбер» продолжает оставаться одной из лучших бумаг на рынке по соотношению цена/качество."
"Thu, 22 Jan 2026 08:00:00 GMT",Сбербанк внедряет ИИ-агента для ускорения анализа данных в Process Mining | IF | 22.01.2026 - InvestFuture,https://investfuture.ru/articles/sberbank-vnedryaet-ii-agenta-dlya-uskoreniya-analiza-dannykh-v-process-mining-1173565960,"Сбербанк в текущем году планирует выпустить на рынок программное обеспечение для платформы Process Mining, которое способно анализировать большие объемы данных. Об этом сообщил заместитель председателя правления банка Тарас Скворцов. ""Наша команда разработала и внедрила первого в России ИИ-агента такого профиля, который находит скрытые взаимосвязи в данных, генерирует обоснованные гипотезы… В 2025 году мы запустили решение внутри 'Сбера', а в этом году предложим его рынку"", — его слова представлены в пресс-релизе в рамках конференции Sber Process Mining. Технология Process Mining направлена на оптимизацию бизнес-процессов с использованием цифровых следов и предлагает более эффективные пути решения задач."
"Tue, 20 Jan 2026 08:00:00 GMT","Сбербанк увеличил чистую прибыль на 8,4% до 1,69 трлн рублей в 2025 году | IF | 20.01.2026 - InvestFuture",https://investfuture.ru/articles/sberbank-uvelichil-chistuyu-pribyl-na-8-4-do-1-69-trln-rubley-v-2025-godu-9EB75DD445AF590B43258D850026C6FC,"В декабре банк заработал 125,9 млрд рублей чистой прибыли (+7,1% г/г)», — говорится в отчетности Сбербанка. В декабре операционные расходы составили 140,8 млрд рублей, увеличившись на 26,1% в годовом выражении. Ипотечный портфель также показал рост на 3,9% за месяц и на 16,5% с начала года, достигнув 12,4 трлн рублей. Средства физических лиц увеличились на 5,8% за месяц и на 20,5% с начала года без учета валютной переоценки, достигнув 33,1 трлн рублей."
