date,title,url,summary
"Sat, 10 Jan 2026 08:00:00 GMT","Сбербанк вернёт деньги за советские вклады: стало известно, кому могут дать выплату - Юга.ру",https://www.yuga.ru/polza/1803/,"Сбербанк вернёт деньги за советские вклады: стало известно, кому могут дать выплату Сбербанк осуществляет выплаты компенсаций по вкладам, размещенным в советский период и ранние постсоветские годы. Эта программа направлена на частичное возмещение средств, которые граждане хранили в сберегательных учреждениях до и во время перехода к рыночной экономике. Специальные виды компенсаций Компенсация на оплату ритуальных услуг Для наследников или лиц, оплативших похороны владельца вклада, предусмотрена фиксированная выплата: - 6000 рублей — если остаток вклада составлял 400 рублей и более - Эта выплата осуществляется независимо от возраста умершего вкладчика Компенсация при незначительных остатках вклада Для случаев, когда остаток вклада составляет менее 400 рублей, действует специальное правило: - Компенсация рассчитывается как остаток вклада × 15 Порядок получения компенсации Необходимые документы Для оформления выплаты потребуется: - Паспорт гражданина Российской Федерации - Сберегательная книжка (при ее наличии) - Для наследников — документы, подтверждающие право наследования - Для получения компенсации на ритуальные услуги — документы, подтверждающие факт оплаты похорон Процедура оформления - Обращение в любое отделение Сбербанка с заявлением о выплате компенсации - Предоставление необходимого пакета документов - Проверка документов банком - Начисление компенсации на счет заявителя Важные аспекты программы компенсаций - Гражданство: Выплаты осуществляются только гражданам Российской Федерации - Сроки действия: Программа имеет ограниченный характер и может быть завершена при исчерпании бюджетных ассигнований - Невозмещаемые вклады: Не подлежат компенсации вклады, открытые: - В Сбербанке после 20 июня 1991 года - В страховых организациях после 1 января 1992 года - - Наследственные вопросы: Право на компенсацию переходит к наследникам вкладчика в установленном законом порядке Программа компенсации советских вкладов представляет собой меру социальной поддержки граждан, чьи сбережения были размещены в финансовых учреждениях в определенные исторические периоды. Выплаты осуществляются в соответствии с федеральным законодательством и постановлениями Правительства Российской Федерации, пишет deita.ru."
"Fri, 09 Jan 2026 08:00:00 GMT","Акции ММВБ: Трамп введет санкции? Сбербанк, ВТБ, Лукойл, Индекс мосбиржи - Smart-Lab",https://smart-lab.ru/blog/tradesignals/1251478.php,"Компания Россети Урал опубликовала отчет об исполнении инвестпрограммы за Q4 2025г., где показаны финансовые показатели компании по РСБУ в... Валентин Погорелый 21:51 ⚙️ Лензолото: закат ""пустышки"" Акции Лензолота резко упали. Лучшие записи за 24 часа самые обсуждаемые сегодня 92к Новые налоги на инвестиции: с инвесторов сдерут три шкуры 83к Индекс МБ сегодня 76к Азия. 36к А что с квитанциями ЖКХ? Самые комментируемые Рейтинг брокеров Купить акции теги блога Martin bitcoin brent CNYRUB IMOEX MOEX акци акции акции ММВБ Акции РФ акции Сбербанка аналитика Анкоридж биткоин Ближний Восток Владимир Зеленский волновая разметка ВТБ доллар доллар рубль Дональд Трамп золото инвестиции в акции Индекс ММВБ индекс волатильности RVI Индекс МБ Индекс ММВБ индекс Мосбиржа индекс мосбиржи Индекс Московской Биржи индекс страха индекс страха и жадности Индия Иран ключевая ставка ключевая ставка ЦБ РФ криптовалюта курс доллара Лукойл Марк Рютте мирные переговоры ммвб МосБиржа Московская биржа НАТО Нефть обзор рынка облигации Роснефть рубль Рынок акции санкции санкции США Сберабанк сбербанк Сургутнефтега США татнефть технический анализ торговые сигналы трейдинг Украина фондовый рынок форекс фьючерс MIX ЦБ РФ экспорт нефти из России юань ....все тэги UP DONW Новый дизайн Во время посещения сайта вы соглашаетесь с использованием файлов cookie Хорошо удалить все комментарии User в этой записи добавить в черный список"
"Mon, 12 Jan 2026 08:00:00 GMT","Что с января ждет тех, кто не удалил «Сбербанк Онлайн» на своем мобильнике - Сибкрай.ru",https://sibkray.ru/2127/zakony/219153,"В конце года среди пользователей распространились тревожные призывы срочно удалить мобильное приложение Сбербанка. Приложение продолжает работать, а его функционал для переводов, платежей и управления счетами сохраняется. Риски значительно возрастают, если: - Приложение было скачано по сомнительной ссылке из сообщения или письма, а не из официального источника. Итог и рекомендации для пользователей Тем, кто продолжает пользоваться «Сбербанк Онлайн», рекомендуется сосредоточиться на практических мерах безопасности, а не на слухах."
"Wed, 14 Jan 2026 14:47:27 GMT","За год под поручительство региональных гарантийных фондов бизнес Черноземья получил кредитов Сбербанка на 5,8 млрд рублей - Go31",https://www.go31.ru/news/obshchestvo/za-god-pod-poruchitelstvo-regionalnykh-garantiynykh-fondov-biznes-chernozemya-poluchil-kreditov-sber/,"При этом максимальный средний чек сформировался в Белгородской области – почти 30 млн рублей. Здесь, как и в Курском регионе, действуют дополнительные меры поддержки бизнеса. Совокупно по всем программам в Белгороде под поручительство Корпорации МСП было выдано 2,4 млрд рублей. Максимальный размер поручительства — 1 млрд рублей, срок — до 10 лет."
"Mon, 12 Jan 2026 08:00:00 GMT",Прогнозы по Сбербанку на 2026 год: стоит ли держать главную «народную» акцию? - Smart-Lab,https://smart-lab.ru/blog/1252117.php,"Блог им. Shneider_Investments 🏦 Доминирующая позиция акций Сбербанка в портфелях частных инвесторов — факт, говорящий о многом. Но главное — это растущие опасения относительно темпов снижения ключевой ставки Банка России и их влияния на маржу банковского сектора в краткосрочной перспективе. 🔄 Инвестиционный кейс Сбербанка в 2026 году будет разворачиваться в два этапа. Бумаги подходят как для формирования дивидендного потока, так и для игры на восстановление рыночной оценки по мере нормализации макроэкономической ситуации."
"Tue, 13 Jan 2026 08:00:00 GMT","Сбер наживается на своих клиентах! – отзыв о Сбербанке от ""user4273093"" | Банки.ру - Банки.ру",https://www.banki.ru/services/responses/bank/response/12856063/,"Сбер наживается на своих клиентах! В один из таких визитов в офис г. Электросталь один из сотрудников нам сообщил, что пока мы не предоставим выписку из ЕГРН с обременением на Сбер, то ставка будет 22%, как только выписку предоставим - банк сразу сменит ставку на 6% (как полагается по семейной программе). Так же 11.12 я в чате уточнила с какого момента поменяется ставка, сотрудник ответил, что второй ежемесячный платеж будет уже по сниженной ставке согласно условиям договора. 30.12.2025 обращаюсь в чат с целью выяснить причины такого недоразумения, на что 31.12 в чате сотрудник запрашивает у меня какое то заявление - о котором ранее нигде не упоминалось и паспорт, копии которого несколько раз были направлены и в чат и в заявку и в офисе его сканили много раз. При обращении по звонку сотрудники переобулись, сказали, что заявление все таки не требуется, паспорт все же еще раз запросили и сформировали обращение на пересмотр ставки."
"Sun, 11 Jan 2026 08:00:00 GMT",Сбербанк вернёт россиянам деньги за советские вклады: кому могут дать выплату - Сибкрай.ru,https://sibkray.ru/2127/finansy/218891,"Программа компенсации по вкладам, сделанным в советскую эпоху, продолжает действовать. Ключевые условия для получения выплаты Право на компенсацию распространяется на два типа вкладов: - Открытые в отделениях Сбербанка (бывшего Сбербанка СССР) до 20 июня 1991 года. - В 2 раза больше остатка — для граждан, родившихся с 1946 по 1991 год. 2. Понижающий коэффициент (по датам операций): Итоговая сумма умножается на дополнительный коэффициент, который зависит от года закрытия вклада или последней операции по нему: - 1,0 — если вклад действовал в 1992-2025 гг., а выплаты были в 1996-2025 гг. - 0,9 — вклад 1992-1994 гг., выплаты в 1995 г. - 0,8 — вклад 1992-1993 гг., выплаты в 1994 г. - 0,7 — вклад 1992 г., выплаты в 1993 г. - 0,6 — вклад 1992 г., выплаты в 1992 г. Отдельная компенсация на похороны Наследникам или лицам, оплатившим похороны владельца вклада, положена фиксированная выплата в 6000 рублей."
"Thu, 15 Jan 2026 08:00:00 GMT",Достала с антресоли старую сберкнижку: в Сбербанке насчитали целое состояние за советские копейки — проверьте свои закрома - ProGorodNN.ru,https://progorodnn.ru/news/144282,"\n""},""content_type"":""banner"",""overlay_start_after"":0,""overlay_close_after"":10000000,""action_button_title"":"""",""tracking_url"":{},""player_show_skip_button_seconds"":5,""player_show_title"":true,""click_event_view"":""whole"",""auto_play"":true,""logo_url"":null,""thumbnail"":"""",""tracking_js"":{""impression"":[""https://js.ad-score.com/score.min.js?pid=1000692#tid=web&l1=14819_direct&l2=593670_direct&l3=1299529_direct&l4=progorodnn.ru&l5=getintent-banner_370171&l6=860818&ref=https%3A%2F%2Fprogorodnn.ru%2F&pub_domain=progorodnn.ru&utid=5d1a89dd-3a60-498e-6ec8-826499bc79fc&uid=92fd7378-b579-4dbf-40ab-47871b1ef02a&cb=4319095653482329019&adid=5d1a89dd-3a60-498e-6ec8-826499bc79fc&auto_refresh=0""]},""click_event_url"":"""",""skip_clickthru"":false,""landing_link_text"":"""",""landing_link_position"":""right"",""displayed_price"":"""",""js_wrapper_url"":"""",""event_url"":""https://exchange.buzzoola.com/event/114a07da-57a8-418c-4100-9d3acebeaf15/5d1a89dd-3a60-498e-6ec8-826499bc79fc/S5S270nv7NxAWTQyjmY2f0-ShKdL5mXzx9C_dQh_Mh7uedPqexbazCOTMvAVP-6RRLuX7hNgoGnYg3nZgcSMzA/"",""resend_event_url"":""https://exchange.buzzoola.com/resend_event/114a07da-57a8-418c-4100-9d3acebeaf15/5d1a89dd-3a60-498e-6ec8-826499bc79fc/S5S270nv7NxAWTQyjmY2f0-ShKdL5mXzx9C_dQh_Mh7uedPqexbazCOTMvAVP-6RRLuX7hNgoGnYg3nZgcSMzA/"",""creative_hash"":""S5S270nv7NxAWTQyjmY2f0-ShKdL5mXzx9C_dQh_Mh7uedPqexbazCOTMvAVP-6RRLuX7hNgoGnYg3nZgcSMzA"",""custom_html"":"""",""custom_js"":"""",""campaign_id"":-1,""line_item_id"":-1,""creative_id"":-1,""extra"":{""imp_id"":""5d1a89dd-3a60-498e-6ec8-826499bc79fc"",""rtime"":""2026-02-16 20:36:46""},""auction_settings"":null,""ad_format_type"":""banner"",""show_legal_info"":true,""ad_label_info"":{""ad_labels"":[[""Рекламодатель"",""ООО \""Вотур Мотор Рус\""""],[""ИНН"",""9705235030""],[""ERID"",""2SDnjebQ8he""]],""seller_link"":""https://jetour-ru.com""},""verifiers_js"":{},""click_block_time"":0,""age_restriction"":"""",""measure_audibility"":false,""is_social_ad"":false}],""tracking_urls"":{""ctor"":[""https://top-fwz1.mail.ru/counter?id=3026769"",""https://cm.g.doubleclick.net/pixel?google_hm=OTJmZDczNzgtYjU3OS00ZGJmLTQwYWItNDc4NzFiMWVmMDJh&google_nid=buzzoola_internet_technologies_limited_liability_company""]},""tracking_js"":{},""placement"":{""placement_id"":1299529,""unit_type"":""inread"",""unit_settings"":{""align"":""center"",""autoplay_enable_sound"":false,""container_height"":""300"",""creative_display_duration"":10,""creatives_amount"":1,""header_selector"":"""",""sound_control"":""default"",""width"":""300""},""unit_settings_list"":[],""disallow_fpc"":false,""code_settings"":{},""env_type"":""web""},""uuid"":""92fd7378-b579-4dbf-40ab-47871b1ef02a"",""auction_id"":""114a07da-57a8-418c-4100-9d3acebeaf15"",""env"":""prod""}; var containerId = ""Caramel_2R5uXMUx9e""; var renderContainer; var nonce = """"; try { renderContainer = document.currentScript.parentNode; nonce = document.currentScript.nonce; } catch (e) {} if (!renderContainer) renderContainer = d.getElementById(containerId); var initTS = Date.now(); function loadScript(src, cb) { var s = d.createElement('script'); s.onload = function () { cb && cb() }; s.onerror = function () { cb && cb(true) }; s.src = src; s.async = true; s.nonce = nonce; d.body.appendChild(s); } function mergeTracking(obj) { var names = ['tracking_url', 'tracking_urls'], i, field, trackings, event, urls; for (i = 0; i < names.length; i++) { field = names[i]; if (obj[field] == null) { obj[field] = {}; } } trackings = obj.tracking_urls; for (event in obj.tracking_url) { if (!obj.tracking_url.hasOwnProperty(event)) continue; urls = obj.tracking_url[event]; trackings[event] = [].concat(trackings[event] || [], urls); } delete obj.tracking_url; return obj; } function createPlayer() { var p = d.createElement('div'), player; if (env) p.setAttribute('data-debug_env', env); if (renderContainer) { renderContainer.appendChild(p); mergeTracking(playerData); var b = w.Buzzoola, referrer = document.referrer, XHRHeaders = {}, data = mergeTracking(playerData.crs[0] || {}), ctorUrl = data.event_url + 'ctor', ctorParams = { site: encodeURIComponent(b.Utils.getTopWindowUrl()), version: (b.version || {}).timestamp, ms_since_init: Date.now() - initTS }, ctorQuery = [], auction = data.auctions_settings, requestDictionary = { external: 'extra_data', slugname: 'slugname', version: 'version' }, retries = 3, trackingTargets = [ { collection: playerData.tracking_urls || {}, type: 'url' }, { collection: data.tracking_urls || {}, type: 'url' }, { collection: playerData.tracking_js || {}, type: 'script' }, { collection: data.tracking_js || {}, type: 'script' } ], trackingHeaders = { 'Content-Type': 'application/x-www-form-urlencoded' }, trackingQuery = 'site=' + encodeURIComponent(w.Buzzoola.Utils.getTopWindowUrl()), prop; playerData.crs = [data]; if (referrer && referrer.length > 255) referrer = referrer.substring(0, 255); XHRHeaders['X-Alt-Referer'] = referrer; if (! !data.extra && b.Utils.isObject(data.extra)) { ctorParams = b.Utils.extend(ctorParams, data.extra); } if (! !auction && b.Utils.isObject(auction) && auction.event_name === 'ctor' && parseInt(auction.time_slice, 10) === 0) { ctorParams = b.Utils.extend(ctorParams, { cur: auction.currency, price: auction.price }); } for (prop in ctorParams) { ctorQuery.push((requestDictionary[prop] || prop) + '=' + ctorParams[prop]); } function sendCtorEvent() { w.Buzzoola.Utils.sendRequest(ctorUrl, 'POST', ctorQuery.join('&'), { withCredentials: true, timeout: 3000 }, XHRHeaders).then(function (result) { var xhr = result.xhr; if (200 > xhr.status || xhr.status > 400) { return Promise.reject(new Error('Bad request status')); } }).catch(function () { if (--retries > 0) { setTimeout(function () { sendCtorEvent(); }, 1000); } }) } function trackURL(url) { var eventUrl = url.replace(/\${RND}/g, Math.round(Math.random() * 1000000000)); if (/\.buzzoola\.com/g.test(w.Buzzoola.Utils.parseURLString(eventUrl).origin)) { w.Buzzoola.Utils.sendRequest(eventUrl, 'POST', trackingQuery, { withCredentials: true, timeout: 3000 }, trackingHeaders); } else { w.Buzzoola.Utils.fetchImage(eventUrl); } } function trackScript(url) { w.Buzzoola.Utils.loadScript(url); } function trackCtorEvent() { trackingTargets.forEach(function (target) { var collection = target.collection, trackerMethod = target.type === 'script' ? trackScript : trackURL; if (Array.isArray(collection.ctor)) collection.ctor.forEach(trackerMethod); }); } (function emitCtor() { sendCtorEvent(); trackCtorEvent(); })(); function strategyFactory(strategy) { function eventHandler(event) { var args = Array.prototype.slice.call(arguments); if (event === 'ctor') return false; return player.callStrategyByMaxWeight.apply(player, [strategy, 999000].concat(args)); } player.addStrategy(strategy, 999999, eventHandler); } player = new w.Buzzoola.Core(p, { adInitTS: initTS, adUrl: 'creative/json', data: playerData }); ['api:send_event', 'tracking_url:send'].forEach(strategyFactory); } } if (w.Buzzoola != null && w.Buzzoola.Buzzplayer != null) { createPlayer(); } else { loadScript('https://tube.buzzoola.com/new/build/buzzlibrary.js', function (err) { if (err) { } else { createPlayer(); } }); } })(window, document);"
"Thu, 15 Jan 2026 08:00:00 GMT","Аналитики Сбербанка прогнозируют инфляцию по итогам января на уровне 1,4-1,7% - Smart-Lab",https://smart-lab.ru/blog/news/1253402.php,"Новости рынков Аналитики Центра макроэкономических исследований «Сбербанка» прогнозируют инфляцию по итогам января на уровне 1,4-1,7%. Месячные темпы инфляции по итогам января составят 1,4-1,7%, что соответствует 12-15% с сезонной корректировкой в годовом выражении. Эксперты также ожидают, что недельные темпы инфляции упадут в ближайшие недели до 0,2-0,3%. При этом годовая инфляция, по их прогнозам, вновь ускорится с 5,6% в декабре по недельным данным до 6-6,2%."
"Thu, 15 Jan 2026 08:00:00 GMT","Сбербанк начал списывать 150 рублей в месяц с тысяч клиентов. Как проверить, не попали ли вы под новую комиссию - Наша Газета | Екатеринбург",https://ngzt.ru/news/sberbank-nachal-spisyvat-150-rublej-v-mesyac-s-tysyach-klientov-kak-proverit-ne-popali-li-vy-pod-novuyu-komissiyu/,"Комиссия не будет взиматься, если по вашему счету (или другим вашим картам в Сбербанке) выполняется одно из условий: - Совершаются платежи на общую сумму свыше 5 000 рублей в месяц. Найдите счета, у которых в описании нет привязанной карты. - Вариант Б: Оформить карту. Что будет, если ничего не делать?"
"Mon, 12 Jan 2026 08:00:00 GMT",Сбербанк начал тайно менять тарифы карт «Мир» и списывать деньги без согласия клиентов? - Пруфы,https://prufy.ru/news/society/179006-sberbank_nachal_tayno_menyat_tarify_kart_mir_i_spisyvat_dengi_bez_soglasiya_klientov/,"В Сбербанке зафиксирована серия жалоб клиентов из разных регионов России. Соответствующие обращения опубликованы 12 января на профильных финансовых платформах. Однако, по ее словам, в официальных реестрах она не числится, а конкретные сроки разблокировки карты в банке не называют. Он попытался перевести 18 926 рублей себе из Сбербанка в Совкомбанк по номеру телефона, однако деньги ушли третьему лицу — незнакомой женщине."
