date,title,url,summary
"Thu, 01 Jan 2026 08:00:00 GMT",Сбербанк ввел плату за обслуживание с 1 января - Финансы Mail,https://finance.mail.ru/article/sberbank-vvel-platu-za-obsluzhivanie-s-1-yanvarya-69194007/,"Для большинства клиентов ежемесячная плата составит порядка 150 рублей, для подростков и молодежи от 14 до 21 года предусмотрен льготный тариф в размере 40 рублей ежемесячно. Чтобы избежать комиссии, клиентам необходимо выполнить одно из условий: - привязать карту Сбербанка к платежному счету, - подключить зачисление на него заработной платы, - осуществлять покупки и переводы со счета на общую сумму от 5 тыс. руб. в месяц. Банк уточняет, что комиссия будет взиматься единоразово, даже если у клиента открыто несколько платежных счетов. Нововведение не затронет счета, которые уже соответствуют указанным критериям бесплатного обслуживания."
"Mon, 05 Jan 2026 08:00:00 GMT",Сбербанк снижает ставки по вкладам и накопительным счетам - Банки.ру,https://www.banki.ru/news/lenta/?id=11020777,"Сбербанк с 5 января снижает максимальную ставку по вкладу «Лучший %» с 16% до 15,5% годовых. На это обращает внимание РБК. При этом получить максимальную ставку по вкладу теперь можно только на сроке три месяца. Подобрать вклад Подходящие предложения Подберите выгодный вклад под ваши цели на Банки.ру"
"Mon, 05 Jan 2026 08:00:00 GMT","Сбербанк снизил максимальную ставку по вкладу до 15,5% - Эксперт",https://expert.ru/news/sberbank-snizil-maksimalnuyu-stavku-po-vkladu-do-15-5/,"Максимальная ставка действует при условии, что клиент до этого не хранил деньги в «Сбере». Она доступна при открытии вклада на три месяца с выплатой процентов в конце срока. Сбербанк уменьшил ставки по вкладам и накопительным счетам на фоне смягчения денежно-кредитной политики ЦБ. Банк России снижает ключевую ставку с июня 2025 года."
"Tue, 06 Jan 2026 08:00:00 GMT",Кто больше не сможет войти в «Сбербанк Онлайн» с 12 января 2026 года - Primpress.ru,https://primpress.ru/article/130068,"Доступ к сервису ограничат для пользователей устаревших смартфонов, старых версий Android и iOS, а также тех, кто давно не обновлял приложение, сообщает PRIMPRESS. На таких устройствах приложение может перестать запускаться, не пускать к авторизации или вовсе пропасть из магазина приложений. В зоне риска — владельцы старых телефонов с «древним» Android или iOS, а также те, кто отключил автообновления и постоянно откладывает установку новых версий. Что делать, если вход заблокирован Если после 12 января 2026 года войти в «Сбербанк Онлайн» не получается, попробуйте обновить операционную систему и само приложение до максимальной доступной версии."
"Thu, 01 Jan 2026 08:00:00 GMT",Деньги лежат без дела — счёт начинает брать своё: Сбер вводит комиссию за спящие счета - Правда.Ру,https://www.pravda.ru/economics/2325987-dormant-bank-accounts/,"С 1 января 2026 года банк начнет взимать плату за обслуживание платежных счетов физических лиц, если они не используются и не связаны с банковской картой. Базовая ставка составит 150 рублей в месяц, а для молодежи от 14 до 21 года — 40 рублей в месяц. Закрыть платежный счет можно как в офисе банка, так и через мобильное приложение. Для регулярных операций выгоднее привязать карту и сохранить бесплатное обслуживание."
"Mon, 05 Jan 2026 08:00:00 GMT",Сбер с 5 января меняет ставки по вкладам - Bankinform.ru,https://bankinform.ru/news/140306,"Новые условия появились на сайте банка. Депозит можно оформить онлайн или в офисе банка. Максимальная ставка 15,5% годовых, установленная на срок 3 месяца, будет действовать на сумму вложения от 1 млн рублей, при оформлении вклада онлайн, без опции пополнения, выплатой процентов в конце срока вклада и с учетом всех вышеперечисленных надбавок. По материалам с сайта банка."
"Sat, 03 Jan 2026 08:00:00 GMT","Звонят с номера 900: Сбербанк объяснил, как не растеряться и распознать мошенников - Юга.ру",https://www.yuga.ru/polza/1005-zvonyat-s-nomera-900-sberbank-obyasnil-kak-ne-rasteryatsya-i-raspoznat-moshennikov/,"Звонят с номера 900: Сбербанк объяснил, как не растеряться и распознать мошенников Сбербанк информирует клиентов об официальных способах связи, чтобы обеспечить безопасность финансовых операций и защитить от мошенников. Официальный номер поддержки Основным и единственным официальным коротким номером для связи с клиентами является 900. Ключевые правила безопасности Чтобы отличить настоящий звонок от мошенников, важно знать стандарты работы Сбербанка: - Общение только по телефону 900: Сотрудники банка никогда не пишут в мессенджерах (WhatsApp, Telegram, Viber) от лица службы поддержки. - Повод для звонка: Банк может позвонить, чтобы уточнить детали по заявленной вами проблеме, помочь с вопросами по сделке или проверить безопасность операций."
"Thu, 08 Jan 2026 08:00:00 GMT",В Сбербанке предупредили об угрозе дипфейков - Национальная Служба Новостей - НСН,https://nsn.fm/society/v-sberbanke-predupredili-ob-ugroze-dipfeikov,"В Сбербанке предупредили об угрозе дипфейков Сбербанк ежедневно выявляет тысячи аккаунтов с дипфейками известных людей и глав компаний для рассылки по их сотрудникам. Об этом рассказал зампред правления банка Станислав Кузнецов в интервью РИА Новости. Эксперт назвал необходимым введение уголовной ответственности за создание и использование дипфейков для обмана по корыстным или политическим мотивам. По его словам, лишь 5% всех мошенничеств в России проводят с использованием подобных цифровых подделок."
"Mon, 05 Jan 2026 08:00:00 GMT",«Лучший %» стал хуже: Сбербанк снизил ставки по вкладу и накопительному счёту - Выберу.ру,https://www.vbr.ru/help/novosti/lycsii-stal-hyje-sberbank-12489/,"«Сбер» следует народной мудрости «тише едешь — дальше будешь»: вслед за снижением ключевой ставки банк понемногу убавляет проценты по вкладу «Лучший %» и накопительному счёту. Но без паники. Если раньше она действовала для вкладов на 3, 4 или 5 месяцев, то теперь максимальный процент (15,5%) доступен только при размещении средств на 3 месяца. То есть чтобы воспользоваться повышенной ставкой, нужно внести сумму, которой не было на ваших вкладах или накопительных счетах в Сбербанке в течение последних двух календарных месяцев."
"Tue, 06 Jan 2026 08:00:00 GMT",Уже с 12 января: кто больше не сможет войти в «Сбербанк Онлайн» - Пруфы,https://prufy.ru/news/society/178780-uzhe_s_12_yanvarya_kto_bolshe_ne_smozhet_voyti_v_sberbank_onlayn/,"С 12 января 2026 года приложение «Сбербанк Онлайн» перестанет функционировать на смартфонах и планшетах с морально устаревшими операционными системами, что затронет ряд устройств на Android и iOS, – сообщает PRIMPRESS. Суть изменений Основное нововведение – принудительное ограничение доступа с устройств, которые не получают обновлений безопасности. Речь идет о старых версиях ОС, которые разработчики больше не поддерживают. Под ограничения могут попасть две основные категории пользователей: - Владельцы старых моделей смартфонов, чьи устройства физически не поддерживают обновление операционной системы до актуальных версий."
"Thu, 08 Jan 2026 08:00:00 GMT","Alipay в России 2026: что это, как пользоваться, пополнить и привязать карту - Frank Media",https://frankmedia.ru/204281?utm_referrer=https%3a%2f%2fnews.google.com%2f,"Для этого нужно: - Зайти в раздел «Аккаунт» - Нажать «Баланс» - Далее перейти в «Заполнить ваши данные» - Внести данные загранпаспорта - Загрузить фото паспорта - Пройти верификацию по лицу Приложение обещает, что данные пользователей полностью защищены. Как пополнить Alipay В приложении можно привязать банковскую карту или пополнить счёт в системе. Есть ли специфические ограничения для россиян в 2026 году? Главное о платежной системе Alipay - Скачать приложение Alipay можно без ограничений в App Store и Google Play - Чтобы пройти верификацию необходимо заполнить информацию о себе, используя данные загранпаспорта - В приложении можно привязать банковскую карту или пополнить аккаунт - Самый доступный и безопасный способ пополнения счета — через Сбербанк - Alipay в Китае можно использовать почти везде"
"Sun, 04 Jan 2026 08:00:00 GMT",Сбербанк ввёл новую комиссию в 150 рублей: кому придётся платить - Deita.ru,https://deita.ru/article/579740,"С наступлением нового года Сбербанк ввёл новую плату за обслуживание определённых видов счетов. Речь идёт о платёжных счетах, к которым не привязана карта, сообщает ИА DEITA.RU. Таким клиентам придётся платить 150 рублей в месяц. Что касается тех, у кого есть счета без карты или без активных операций, им придётся платить указанную сумму ежемесячно, если же ранее они не обновили тарифы, то есть возможность сделать это через мобильное приложение или онлайн-банкинг — и тогда обслуживание станет бесплатным навсегда."
"Sat, 03 Jan 2026 08:00:00 GMT","С сегодняшнего дня: Сбербанк ввел изменение для всех, у кого имеется карта «Мир» - Сибкрай.ru",https://sibkray.ru/2127/finansy/212677,"Крупнейший финансовый институт России представил существенные улучшения для держателей карт национальной платежной системы. Эти изменения кардинально меняют опыт взаимодействия с банковскими продуктами, предлагая клиентам дополнительные преимущества в повседневном использовании. Международное признание: ваш рубль за рубежом Знаковым изменением стало серьезное расширение международного присутствия карт «Мир». Теперь владельцы карт могут рассчитываться в значительном количестве новых стран, что особенно актуально в текущих условиях."
"Mon, 05 Jan 2026 08:00:00 GMT","Как установить «СберБанк Онлайн», «Т‑Банк», «Альфа-Банк» и не только на iPhone - Лайфхакер",https://lifehacker.ru/kak-ustanovit-prilozheniya-bankov/,"И если установить «СберБанк Онлайн» или «Альфа-Банк» на Android не проблема — официальные APK есть на сайтах банков, — то в случае с iPhone так просто ничего не выйдет. Мы рекомендуем ориентироваться только на эти два источника и не скачивать приложения по рекомендации сайтов и пабликов без ссылки на официальных представителей банка. Это означает, что на старом телефоне программу скачивали из App Store, но она больше не доступно в магазине. И для вас, и для того, кто одолжил вам телефон, это не несёт никаких рисков: его Apple ID не будет добавлен на ваш телефон или в App Store, а вы не получите доступ к чужому аккаунту."
"Mon, 05 Jan 2026 08:00:00 GMT",В Сбербанке рассказали о самой мощной атаке в истории компании - Финансы Mail,https://finance.mail.ru/article/v-sberbanke-rasskazali-o-samoj-moshnoj-atake-v-istorii-kompanii-69194193/,"«Каждые три минуты, условно, одна из российских компаний испытывает на себе атаку со стороны киберпреступников. Сбер остается одной из главных целей. Например, пик мощнейшей DDoS-атаки в 2025 году составлял 324 млн пакетов в секунду (Packets Per Second) — показатель для измерения мощности DDoS-атак — ред.), что на 69% больше предыдущего рекорда января 2023 года. Атака шла на сайт Сбера с целью парализовать его работу», — сказал он."
"Mon, 05 Jan 2026 17:55:24 GMT","Сбербанк ввел плату за ""спящие"" счета: как избежать расходов с 2026 года - Банки.ру",https://www.banki.ru/dialog/articles/40853/,"В соответствии с новыми условиями, стандартная комиссия за обслуживание счета без привязанной карты составит 150 рублей в месяц. Для клиентов, активно использующих свой счет, банк не будет взимать дополнительную плату. Лично у меня вопрос - в чём заключается ""обслуживание"" этих ""спящих"" счетов? Видимо, точно греф, эти циферки тряпочкой протирает каждый месяц 🤭 Аль Кнопконе, да у меня <5т ₽, значит и у меня , ожидается списание небольших остаточных сумм , до 0₽00к Приехал как то в налоговую,и в том месте появилось немного времени.Рядом сбербанк,о прикольно щас как карту сделаю .Обращаюсь к менеджеру,пол часа просидел анкеты заполнил.А мы вас не можем обслужить по этому тарифу ,у вас уже есть такая карта у нас.Я,да ну нафиг ,я у вас в банке с советского времени не был.Нет у нас все точно на ваше имя вот счет и карта.Странно, непонятно,интересно).Но после этого я сбербанк как то стараюсь обходить подальше в любых вопросах.Карту так в тот промежуток времени так и не оформил."
"Mon, 05 Jan 2026 08:00:00 GMT","С сегодняшнего дня: Сбербанк ввел изменения всем, кто переводит с карты на карту - Primpress.ru",https://primpress.ru/article/130042,"Что именно изменилось Банк пересмотрел условия переводов между картами физических лиц: затронуты лимиты, комиссии и отдельные способы перевода – как внутри Сбера, так и на карты других банков. Переводы внутри Сбера Переводы между своими счетами и картами, а также небольшие переводы близким через «СберБанк Онлайн» чаще всего остаются без комиссии. Переводы по номеру телефона через СБП на карты других банков в большинстве случаев оказываются дешевле обычных карточных переводов. До определенной суммы в месяц многие такие операции проходят без комиссии или с минимальной платой, что выгодно тем, кто часто отправляет деньги в другие банки."
"Fri, 02 Jan 2026 08:00:00 GMT",Сбербанк назвал основные киберугрозы для российских компаний - Национальная Служба Новостей - НСН,https://nsn.fm/society/sberbank-nazval-osnovnye-kiberugrozy-dlya-rossiiskih-kompanii,"Сбербанк назвал основные киберугрозы для российских компаний Зампредседателя правления Сбербанка Станислав Кузнецов перечислил ключевые киберугрозы для российских организаций в 2025 году. Об этом он рассказал в интервью РИА Новости. «В 2025 году... ключевыми угрозами остались DDoS-атаки, кибершпионаж и атаки, направленные на приостановку работы или уничтожение ИТ-инфраструктуры c целью остановить бизнес-процессы», - отметил эксперт. Злоумышленники рассчитывают получить своими действиями финансовую выгоду, вызвать резонанс в медиа, спровоцировать недоверие граждан к государству и бизнесу."
"Wed, 07 Jan 2026 08:00:00 GMT",Сбер с 1 января изменил условия использования кредитных карт - Bankinform.ru,https://bankinform.ru/news/140309,"С 1 января 2026 года Сбер внёс изменения в условия использования кредитных карт. Эти изменения касаются комиссии за снятие кредитных средств и переводы, а также ставок по кредитным операциям. Новые комиссии Снятие наличных, переводы, в том числе переводы через сайты и приложения других банков, не являются льготными операциями (за исключением льготной суммы 50 тыс рублей по карте «Фикс»). Это затрагивает все кредитные карты банка, включая: - СберКарту 120 дней (подробнее о карте); - молодёжную карту; - карту «Фикс» - при превышении бесплатного лимита в 50 тысяч рублей (подробнее о карте)."
