date,title,url,summary
"Thu, 22 Jan 2026 08:00:00 GMT","С 23 января: Сбербанк предупредил об изменениях всех, кто переводит с карты на карту - Сибкрай.ru",https://sibkray.ru/2127/finansy/220726,"С 23 января 2026 года ПАО «Сбербанк» ввёл изменения в тарифы на переводы с карты на карту для физических лиц. Под обновление попали бесплатные лимиты, размер комиссий и максимальные суммы для операций как внутри банка, так и в другие финансовые организации. Основные изменения в тарифах Изменения направлены на пересмотр привычных для клиентов условий: - Скорректированы бесплатные лимиты для переводов между картами Сбербанка и операций через Систему быстрых платежей (СБП). - Отдавать предпочтение наиболее выгодным способам, которыми, как правило, остаются переводы между клиентами Сбербанка и операции через СБП (особенно при отправке денег в другие банки)."
"Wed, 28 Jan 2026 08:00:00 GMT",Новое уголовное дело возбудили на бывшего менеджера Сбербанка в Челябинске - Kursdela.biz,https://kursdela.biz/news/2026-01-28/novoe-ugolovnoe-delo-vozbudili-na-byvshego-menedzhera-sberbanka-v-chelyabinske-5542152?utm_source=news.google.com&utm_medium=referral&utm_campaign=news.google.com&utm_referrer=news.google.com,"Posted 28 января, 11:00 Published 28 января, 11:00 Modified 28 января, 17:49 Updated 28 января, 17:49 Следствие считает, что Анатолий Скаленко в ноябре 2021 года получил от заместителя гендиректора одной из строительных фирм региона взятку в виде туристических сертификатов на сумму 1,5 миллиона рублей. В обмен он должен был создать благоприятные условия для открытия и поддержания кредитных линий и ускорить процесс одобрения и выдачи займа. Преступление выявили сотрудники областного УФСБ. Возбуждено уголовное дело по статье о получении взятки в особо крупном размере (ч. 6 ст. 290 УК РФ)."
"Mon, 26 Jan 2026 08:00:00 GMT","""Эксперт РА"" подтвердил рейтинг кредитоспособности финкомпании АО ""Сбербанк КИБ"" на уровне ruAAА - profinansy.ru",https://lenta.profinansy.ru/news/4977265,"27 января. АО ""Сбербанк КИБ"" - профессиональный участник рынка ценных бумаг, имеющий лицензии на осуществление дилерской, брокерской и депозитарной деятельности. АО ""Сбербанк КИБ"" также включено в единый реестр Кредитный рейтинг АО ""Сбербанк КИБ"" присвоен в соответствии с методологией оценки внешнего влияния на кредитный рейтинг на уровне условного рейтингового класса поддерживающей структуры (ПАО ""Сбербанк""), ruAAА, по совокупности следующих критериев. По оценкам агентства, оказание поддержки компании не скажется негативным образом на кредитоспособности поддерживающей структуры."
"Mon, 26 Jan 2026 08:00:00 GMT",ВС разъяснит последствия одновременного оформления кредитов в двух банках - РАПСИ,https://rapsinews.ru/judicial_news/20260126/311534585.html,"МОСКВА, 26 янв — РАПСИ. Верховный суд (ВС) РФ 26 февраля разъяснит, является ли одновременное оформление кредитов в двух банках основанием для неосвобождения должника от обязательств перед кредиторами при завершении процедуры реализации его имущества. Не согласившись с судебными актами апелляционного и окружного судов, Сбербанк обратился с кассационной жалобой в Верховный суд. Позиция заявителя Заявитель ссылается на недобросовестные действия Долакова, который заключил в один день кредитные договоры в двух разных банках с целью сокрытия информации о долговой нагрузке и в отсутствие намерений по исполнению взятых на себя обязательств. Так, 4 августа 2023 года должник оформил в офисе Сбербанка кредит на 3 589 000 рублей, а затем в тот же день заключил кредитный договор на 1 миллион рублей с банком ВТБ."
"Thu, 29 Jan 2026 08:00:00 GMT",Сбербанк дает крайне негативный прогноз для рубля - ProFinance.Ru,https://www.profinance.ru/news2/2026/01/29/cids-sberbank-daet-krajne-negativnyj-prognoz-dlya-rublya.html,"Курс доллара к рублю расчётный, фьючерс, вечный фьючерс и межбанк. Курс евро к рублю расчётный, фьючерс, вечный фьючерс и межбанк. Курс юаня к рублю биржевой, фьючерс, вечный фьючерс и межбанк. Такое мнение предоставляется исключительно для целей ознакомления и не является рекомендацией для покупки, продажи ценных бумаг, принятия (или непринятия) каких-либо коммерческих или иных решений."
"Wed, 28 Jan 2026 08:00:00 GMT","Что с февраля ждет тех, кто не удалил «Сбербанк Онлайн» со своего телефона - Юга.ру",https://www.yuga.ru/polza/2516/,В сети вновь распространяются панические призывы срочно удалить мобильное приложение «Сбербанк Онлайн». - Передаёт коды из СМС или push-уведомлений «сотруднику службы безопасности» по телефону. Что ужесточат банки? Банк никогда не запрашивает их по телефону.
"Wed, 28 Jan 2026 08:00:00 GMT",«Плевать на удобство клиента»: туляки недовольны закрытием сразу трех отделений Сбербанка - MySlo,https://myslo.ru/news/tula/2026-01-28-tulyaki-nedovol-ny-zakrytiem-srazu-treh-otdelenij-sberbanka,Текст слишком короткий
"Thu, 29 Jan 2026 08:00:00 GMT","Обманули в офисе Сбербанка – отзыв о Сбербанке от ""andrey125"" - Банки.ру",https://www.banki.ru/services/responses/bank/response/12873636/,"Обманули в офисе Сбербанка Сегодня оформлял карту в офисе сбербанка. Спросил какие условия, говорят бесплатно если тарите 5000р. Я спрашиваю а оплата коммуналки или платежи по СБП включается. Через два месяца... Самый надежный Сбербанк Хочу поблагодарить Сбербанк."
"Thu, 29 Jan 2026 08:00:00 GMT",Акции Сбербанка подорожали до 311 рублей - Ведомости,https://www.vedomosti.ru/investments/news/2026/01/29/1172707-aktsii-sberbanka,"Акции Сбербанка подорожали до 311 рублей Акции Сбербанка на торгах Московской биржи продемонстрировали рост на 2,4% и достигли 311 руб. по состоянию на 17:35 мск. 20 января Сбербанк опубликовал финансовые результаты по РСБУ по итогам 2025 г. Чистая прибыль банка за прошлый год выросла на 8,4% относительно 2024 г. и достигла 1,69 трлн руб. при рентабельности капитала 22,1%. Чистые процентные доходы за год увеличились на 17,7% и составили 3,1 трлн руб. Чистые комиссионные доходы упали на 2,6% до 726,8 млрд руб. Операционные расходы выросли на 16,1% до 1,1 трлн руб. Отношение расходов к доходам в прошлом году составило 29,5%. 10 декабря 2025 г. председатель правления Сбербанка Герман Греф заявил о планах банка в 2026 г. выплатить дивиденды в размере 50% от прибыли по МСФО за год. В 2026 г. финансовая организация намерена поддержать высокую рентабельность капитала на уровне 22% и его достаточность на целевом уровне 13,3%."
"Thu, 29 Jan 2026 08:00:00 GMT",Правительство РФ укрепляет контроль над Сбербанком через новый набсовет | IF | 29.01.2026 - InvestFuture,https://investfuture.ru/articles/pravitelstvo-rf-ukreplyaet-kontrol-nad-sberbankom-cherez-noviy-nabsovet-1173979244,"Правительство Российской Федерации предложило кандидатуры для участия в наблюдательном совете Сбербанка. Информация об этом размещена на официальном портале нормативных правовых актов. В документе указано: ""Выдвинуть кандидатов для избрания в качестве представителей Российской Федерации в наблюдательный совет публичного акционерного общества 'Сбербанк России' (город Москва) согласно приложению... Колычев В. В. - заместитель министра финансов Российской Федерации, Новак А.В. - заместитель председателя правительства Российской Федерации, Орешкин М.С. - заместитель руководителя администрации президента Российской Федерации, Силуанов А.Г. - министр финансов Российской Федерации"". Подписывайтесь на наш канал в Телеграм: все главные новости о финансах, ничего лишнего!"
"Thu, 22 Jan 2026 08:00:00 GMT","Сбербанк покупает 41,9% акций ""Элемента"" за 27 млрд рублей | IF | 22.01.2026 - InvestFuture",https://investfuture.ru/articles/sberbank-pokupaet-41-9-aktsiy-elementa-za-27-mlrd-rubley-0291AE243C59447643258D87005DB6A3,"Сбербанк завершил сделку по приобретению 41,9% акций компании ПАО ""Элемент"", занимающейся производством микроэлектроники в России. Стоимость сделки составила 27 миллиардов рублей, как сообщили в пресс-службе банка. Корпорация АФК ""Система"", ранее владевшая 37,6% акций, полностью вышла из состава акционеров ""Элемента"". Данное событие было подтверждено в официальном сообщении корпорации."
"Thu, 29 Jan 2026 08:00:00 GMT",Сбербанк установил новую комиссию в 150 рублей: кому придётся платить - Наша Газета | Екатеринбург,https://ngzt.ru/news/sberbank-ustanovil-novuyu-komissiyu-v-150-rublej-komu-pridyotsya-platit/,"Сейчас наличие неиспользуемого счёта без карты обойдётся в 150 рублей ежемесячно для взрослых клиентов. Что такое «платёжный аккаунт» и почему он может быть у вас? Платёжный аккаунт (ранее — текущий или карточный счёт) — это основа, к которой «подключается» карта. Ранее на такой «невидимый» аккаунт можно было не обращать внимания."
"Wed, 28 Jan 2026 08:00:00 GMT","Операторы связи прекратили маркировку звонков от Сбербанка, ВТБ и Альфа-банка с 27 января - BFM.ru",https://www.bfm.ru/news/596460,"Операторы связи прекратили маркировку звонков от Сбербанка, ВТБ и Альфа-банка с 27 января Лента новостей Как пишут СМИ, причиной стало отсутствие заключенных договоров между кредитными организациями и операторами на оказание этой услуги. Дальше вернемся в Мурманск. Но и это не все. Но там есть другие проблемы, связанные с питанием."
"Fri, 23 Jan 2026 08:00:00 GMT",В Ростовском отделении Сбербанка назначили нового заместителя управляющего - 1rnd.ru,https://www.1rnd.ru/news/obshchestvo/v-rostovskom-otdelenii-sberbanka-naznachili-novogo-zamestitelya-upravlyayushchego-/,- Проверьте настройки прокси-сервера и брандмауэра. - Выполните диагностику сети в Windows ERR_CONNECTION_RESET Проверьте подключение к интернету. Разрешите доступ к сети для Chrome в настройках брандмауэра или антивируса. Соединение сброшено.
"Sun, 25 Jan 2026 08:00:00 GMT","Накопительный счет от Сбербанка - аналогов нет! – отзыв о Сбербанке от ""user-220518527939"" - Банки.ру",https://www.banki.ru/services/responses/bank/response/12875682/,"09.01.2026 обратился в чат поддержки Сбера (через веб-версию, приложение я не ставлю на телефон, мне оно не нужно) с вопросом - есть ли у них накопительный счет, чтобы можно было деньги класть и снимать в течение дня, а проценты капали. Отвечать стала Олеся. НЕ НАДО МНЕ ЗВОНИТЬ!! 2) Накопительный счет со ставкой 0,01% годовых."
"Tue, 27 Jan 2026 08:00:00 GMT","Волонтеры Сбера развивают цифровое образование, повышают финансовую грамотность и заботятся о здоровье жителей региона - Тюменская линия",https://t-l.ru/394838.html,"Волонтеры Сбера развивают цифровое образование, повышают финансовую грамотность и заботятся о здоровье жителей региона Сбер в Тюменской области помимо предоставления стандартных банковских услуг активно занимается волонтерской деятельностью. В 2025 году у команды было три ключевых направления: повышение финансовой грамотности, реализация федерального проекта ""Урок цифры"", а также поддержка программы ""Деменция.нет"". Для школьников и студентов волонтеры проводили лекции, экскурсии и образовательные занятия по повышению финансовой грамотности. Также стали наставниками для детей социально-реабилитационных центров."
"Wed, 28 Jan 2026 08:00:00 GMT","ЦБ оштрафовал Сбербанк, Совкомбанк и Яндекс Банк - Банки.ру",https://www.banki.ru/news/lenta/?id=11021337?comment_sort=new,"Банк России вынес постановления о привлечении к административной ответственности Сбербанка, Совкомбанка и Яндекс Банка. Соответствующие материалы размещены на сайте регулятора. В отношении всех трех кредитных учреждений постановления вынесены по статье 15.26.3 КоАП «Неисполнение обязанности по подтверждению и представлению исправленных сведений, содержащихся в основной части кредитной истории, в бюро кредитных историй». Статья предусматривает наложение административного штрафа на должностных лиц в размере от 2 тысяч до 5 тысяч рублей, на юридических лиц — от 30 тысяч до 50 тысяч рублей."
"Fri, 23 Jan 2026 08:00:00 GMT",Сбербанк и Ростелеком договорились о стратегическом партнерстве по приему онлайн-платежей - Городские вести,https://gorvesti.ru/society/sberbank-i-rostelekom-dogovorilis-o-strategicheskom-partnerstve-po-priemu-onlayn-platezhey-216527.html,"Сбербанк и Ростелеком договорились о стратегическом партнерстве по приему онлайн-платежей Сбер и Ростелеком укрепили сотрудничество, подписав новое соглашение в сфере интернет-эквайринга. Подписывайтесь на наш канал в Дзене Вы всегда будете в курсе событий По итогам трёх тендеров Сбер стал эксклюзивным партнёром Ростелекома по оказанию услуг интернет-эквайринга, обеспечению работы системы бесконтактных платежей SberPayи проведению расчётов через Систему быстрых платежей (СБП). Партнёрство позволит обеспечить максимальный комфорт и широкий выбор способов оплаты абонентам Ростелекома при пользовании услугами интернета, телевидения и облачной инфраструктуры — количество таких платежей составит порядка 110 млн в год. В рамках договора особое внимание уделяется популяризации современного инструмента бесконтактных платежей SberPay, обеспечивающего быстрое и защищенное совершение транзакций без необходимости ввода карточных данных."
"Thu, 22 Jan 2026 08:00:00 GMT",Волго-Вятский банк Сбербанка помог уберечь от мошенников 680 млн рублей - иа сусанин,https://susanin.news/russia/other/20260122-335522/,"В Нижегородской области от злоумышленников смогли уберечь 178 млн рублей, в Пермском крае — свыше 169 млн рублей, в Чувашской Республике — более 70 млн рублей. В Республике Марий Эл благодаря Сберу было сохранено 34 млн рублей, во Владимирской области — 32,5 млн рублей, в Республике Мордовия — 11,6 млн рублей. Сегодня наиболее распространены бытовые сценарии по темам ЖКХ: замена домофона, электрики, сантехники, а также используется тематика доставки по почте, через маркетплейсы и курьерами. Актуальной схемой мошенничества также остаётся получение доступа к аккаунту на «Госуслугах»."
"Fri, 23 Jan 2026 08:00:00 GMT",Сбербанк прибрал к рукам почти половину гигантского российского производителя микроэлектроники - ZOOM.CNews.ru,https://zoom.cnews.ru/news/item/673212,"Сбербанк получил крупнейшую долю – 41,9%, а дополнительные 41,66% находились в собственности «Ростеха». С прицелом на будущее ГК «Элемент» существует в своем нынешнем виде с 2019 г. и включает в себя несколько крупных компаний в сфере микроэлектроники. Что задумал Сбербанк К моменту выхода материала цель вхождения Сбербанка в капитал ГК «Элемент» не раскрывалась. «Интерфакс» пишет, что структура владения активами ГК «Элемент» «останется неизменной»."
"Thu, 22 Jan 2026 08:00:00 GMT","Доказать ничего не можем, но вы нам должны - Банки.ру",https://www.banki.ru/services/responses/bank/response/12871521/,"Никаких документальных подтверждений нет, но деньги требуют. И никакой истории что было до, и что стало после с 2014 по 2025. У них нет ответа почему банк не давал об этом никак знать и как человек может быть вообще не в курсе, что у него там задолженность висит столько лет. До декабря 2024 года все задолженности..."
"Fri, 23 Jan 2026 08:00:00 GMT",Стоит ли инвестировать в акции Элемента под оферту Сбербанка? | IF | 23.01.2026 - InvestFuture,https://investfuture.ru/articles/stoit-li-investirovat-v-aktsii-elementa-pod-ofertu-sberbanka,"Сбер приобрел 37,6% акций у Системы и 4,3% — у миноритариев. По закону, Сбербанк должен был выставить оферту на выкуп акций у миноритариев, не согласных со сделкой. На наш взгляд, выкуп акций Элемента по текущей оферте пройдет плюс-минус по минимальной цене, то есть 0,1372 рубля за бумагу. При этом, если акции немного прольют, то возможно сделка станет более привлекательной."
